{
  "schemaVersion": 3,
  "taskId": "FRONTEND-GOVERNANCE-FACTFIX-20260802",
  "controlPath": "docs/development/tasks/FRONTEND-GOVERNANCE-FACTFIX-20260802-CONTROL.json",
  "startedAt": "2026-08-02T16:35:00Z",
  "lane": "L0",
  "lifecycleState": "CONTRACT_FROZEN",
  "contract": {
    "path": "docs/development/tasks/FRONTEND-GOVERNANCE-FACTFIX-20260802-CONTRACT.md",
    "version": "1",
    "sha256": "91c0e3953b29fc3a9603c40a5685dbe1b12780defcb4d361cdd4793d6d0a1489",
    "acceptanceCriteria": [
      {"id": "AC-01", "requiredEvidence": ["STATIC"]}
    ],
    "implementationSlices": [
      {
        "id": "SLICE-01",
        "description": "7 fact docs D-status alignment (delivered on candidate 46df0de)",
        "acIds": ["AC-01"],
        "allowedWritePaths": ["docs/AI_HANDOFF.md"],
        "maxExpectedFiles": 8,
        "maxProductionLineDelta": 500
      }
    ],
    "testInventory": [
      {"testId": "TEST-01", "acIds": ["AC-01"], "kind": "STATIC", "required": true, "sourcePath": "docs/AI_HANDOFF.md", "selector": "已进入 main"}
    ],
    "blockingAmendments": []
  },
  "git": {
    "automation": "DELIVERY_PUSH",
    "branch": "codex/frontend-governance-bootstrap-20260802",
    "baselineCommit": "563e84a573426800b3f6aa8e4e0525bc5314b3a8",
    "preExistingDirtyPaths": [".zcode/plans/plan-sess_9d474463-de01-4d3b-9aea-08fb2e5154d5.md"]
  },
  "transitionHistory": [
    {"sequence": 1, "from": "CONTEXT_READY", "to": "CONTRACT_DRAFTED", "at": "2026-08-02T16:35:00Z", "actor": "zcode-parent-FRONTEND-GOVERNANCE-FACTFIX-20260802"},
    {"sequence": 2, "from": "CONTRACT_DRAFTED", "to": "CONTRACT_FROZEN", "at": "2026-08-02T16:36:00Z", "actor": "zcode-parent-FRONTEND-GOVERNANCE-FACTFIX-20260802"}
  ],
  "candidate": {
    "mode": "SNAPSHOT",
    "generation": 2,
    "identity": "b559e428d95d57f9ba3006bc4afcd4ec896ab107d4adf19d8301323ed35f15d1",
    "commit": "",
    "treeHash": "",
    "patchSha256": "",
    "manifestPath": "docs/development/tasks/FRONTEND-GOVERNANCE-FACTFIX-20260802-candidate-manifest.json",
    "manifestSha256": "b559e428d95d57f9ba3006bc4afcd4ec896ab107d4adf19d8301323ed35f15d1",
    "entrySetSha256": "14a77912fe0f1fb4ba9d012c112f0d7f069ba71e0311169a1e9bc930bd25140a",
    "diffArtifactPath": "docs/development/tasks/FRONTEND-GOVERNANCE-FACTFIX-20260802-candidate-diff.patch",
    "diffArtifactSha256": "ec7f8fad780b639f37b492665ff356d95b27c35a1326e5214a552866c2644231"
  },
  "budget": {
    "contextPercent": null,
    "contextMeasurement": "UNAVAILABLE",
    "compactionCount": 0,
    "repairRound": 0,
    "maxRepairRounds": 2,
    "maxWaitCallsPerRole": 2,
    "maxShellPollsPerCommand": 3,
    "rawTokens": null,
    "weeklyAllowancePercent": null
  },
  "repairHistory": [],
  "roleRuns": [],
  "review": {
    "omitted": true,
    "omissionReason": "L0 contract-lite: docs-only fact alignment already shipped on candidate; verify+finalize only",
    "generation": 0,
    "candidateIdentity": "",
    "functionalVerdict": "NOT_VERIFIED",
    "architectureVerdict": "NOT_REQUIRED",
    "artifactPath": "",
    "artifactSha256": "",
    "architectureGateSha256": "",
    "findingIds": []
  },
  "architectureGate": {
    "required": false,
    "candidateIdentity": "",
    "status": "NOT_REQUIRED",
    "exitCode": 0,
    "errorCount": 0,
    "warningCount": 0,
    "warningDispositions": [],
    "reportPath": "",
    "reportSha256": "",
    "generatedBy": "scripts/check-ai-architecture.mjs"
  },
  "verification": {
    "candidateIdentity": "",
    "verdict": "NOT_VERIFIED",
    "deliveryPermitted": false,
    "functionalVerdict": "NOT_VERIFIED",
    "architectureVerdict": "NOT_REQUIRED",
    "artifactPath": "",
    "artifactSha256": "",
    "architectureGateSha256": "",
    "dimensions": {
      "STATIC": {"required": true, "status": "NOT_VERIFIED"},
      "AUTOMATION": {"required": false, "status": "NOT_REQUIRED"},
      "RUNTIME": {"required": false, "status": "NOT_REQUIRED"},
      "DEPLOYMENT": {"required": false, "status": "NOT_REQUIRED"}
    }
  },
  "testEvidence": [],
  "finalization": {
    "status": "NOT_STARTED",
    "candidateIdentity": "",
    "artifactPath": "",
    "artifactSha256": "",
    "completedAt": "",
    "changedPaths": []
  },
  "evidence": []
}
